"","Table C-5-1  HVSI Specimens Rating Criteria"
"Rating","Criteria"
"0","No mortar layer at the top of the cut plane and no variance in size and percent area of coarse aggregate"
"stable","distribution from top to bottom."
"1","No mortar layer at the top of the cut plane but slight variance in size and percent area of coarse aggregate"
"stable","distribution from top to bottom."
"2","Slight mortar layer, less than 1 inch tall, at the top of the cut plane and distinct variance in size and percent"
"unstable","area of coarse aggregate distribution from top to bottom."
"3","Clearly segregated as evidenced by a mortar layer greater than 1 inch tall and/or considerable variance in"
"unstable","size and percent area of coarse aggregate distribution from top to bottom."
